{
  "schema_version": "v1",
  "license": "apache-2.0",
  "checkpoint_hash": "1111111111111111111111111111111111111111111111111111111111111111",
  "manifest_hash": "0000000000000000000000000000000000000000000000000000000000000000",
  "tokenizer_hash": "2222222222222222222222222222222222222222222222222222222222222222",
  "index_id": "00000000-11111111",
  "training_compute_h100_hours": 240,
  "seeds_reported": 3
}
